[
  {
    "chunk_id": "doc_nice_acs_chest_pain_chunk_0",
    "document_id": "doc_nice_acs_chest_pain",
    "source_id": "nice_guidelines",
    "block_index": 0,
    "section_path": [
      "NICE Guideline [NG185]: Acute Coronary Syndromes (ACS) & Chest Pain",
      "Overview & Context"
    ],
    "heading": "Overview & Context",
    "text": "# NICE Guideline [NG185]: Acute Coronary Syndromes (ACS) & Chest Pain\nPublished: November 2020 | Last updated: 2023",
    "content_sha256": "7d6b5ce20eb502f29e7d9b2bc2a678c8973d15b1545f44fce753d72ab8d9f4d8",
    "provenance_type": "local_markdown",
    "source_locator": "nice_acs_chest_pain.md#Overview & Context",
    "title": "NICE Guideline [NG185]: Acute Coronary Syndromes (ACS) & Chest Pain",
    "section": "Overview & Context",
    "token_count": 15,
    "metadata": {
      "source_file": "nice_acs_chest_pain.md",
      "doc_id": "doc_nice_acs_chest_pain"
    }
  },
  {
    "chunk_id": "doc_nice_acs_chest_pain_chunk_1",
    "document_id": "doc_nice_acs_chest_pain",
    "source_id": "nice_guidelines",
    "block_index": 1,
    "section_path": [
      "NICE Guideline [NG185]: Acute Coronary Syndromes (ACS) & Chest Pain",
      "Initial Assessment of Suspected Cardiac Chest Pain"
    ],
    "heading": "Initial Assessment of Suspected Cardiac Chest Pain",
    "text": "## Initial Assessment of Suspected Cardiac Chest Pain\n- Take a resting 12-lead ECG as soon as possible.\n- Do not rule out ACS simply because chest pain is atypical or relieved by sublingual nitrates.\n- Key signs of STEMI: ST-segment elevation of ≥1 mm in two or more contiguous limb leads or ≥2 mm in contiguous chest leads, or new LBBB.",
    "content_sha256": "ecb1a690fff7d39a5b17d2e1ec94a043d80c7ba7c9c064e1505afd0f6f86d49b",
    "provenance_type": "local_markdown",
    "source_locator": "nice_acs_chest_pain.md#Initial Assessment of Suspected Cardiac Chest Pain",
    "title": "NICE Guideline [NG185]: Acute Coronary Syndromes (ACS) & Chest Pain",
    "section": "Initial Assessment of Suspected Cardiac Chest Pain",
    "token_count": 60,
    "metadata": {
      "source_file": "nice_acs_chest_pain.md",
      "doc_id": "doc_nice_acs_chest_pain"
    }
  },
  {
    "chunk_id": "doc_nice_acs_chest_pain_chunk_2",
    "document_id": "doc_nice_acs_chest_pain",
    "source_id": "nice_guidelines",
    "block_index": 2,
    "section_path": [
      "NICE Guideline [NG185]: Acute Coronary Syndromes (ACS) & Chest Pain",
      "Immediate Emergency Management of STEMI"
    ],
    "heading": "Immediate Emergency Management of STEMI",
    "text": "## Immediate Emergency Management of STEMI\n1. **Dual Antiplatelet Therapy (DAPT):**\n   - Aspirin: 300 mg loading dose orally (unless allergic).\n   - Second antiplatelet: Ticagrelor 180 mg (preferred) or Prasugrel 60 mg or Clopidogrel 300-600 mg.\n2. **Reperfusion Therapy:**\n   - Offer immediate coronary angiography with a view to primary PCI if presentation is within 12 hours of symptom onset and PCI can be delivered within 120 minutes of when fibrinolysis could have been given.\n   - If primary PCI cannot be delivered within 120 minutes, offer fibrinolysis immediately.\n3. **Analgesia & Oxygen:**\n   - Offer IV opioids (diamorphine or morphine) titrated to relieve pain.\n   - Supplemental oxygen only if SpO2 < 94% on room air (or < 88% in COPD/hypercapnic respiratory failure risk).",
    "content_sha256": "050a2991f7bb25455d758308cfaab0ea70b4a8c3caaeb31105db8ec67075c486",
    "provenance_type": "local_markdown",
    "source_locator": "nice_acs_chest_pain.md#Immediate Emergency Management of STEMI",
    "title": "NICE Guideline [NG185]: Acute Coronary Syndromes (ACS) & Chest Pain",
    "section": "Immediate Emergency Management of STEMI",
    "token_count": 112,
    "metadata": {
      "source_file": "nice_acs_chest_pain.md",
      "doc_id": "doc_nice_acs_chest_pain"
    }
  },
  {
    "chunk_id": "doc_nice_acs_chest_pain_chunk_3",
    "document_id": "doc_nice_acs_chest_pain",
    "source_id": "nice_guidelines",
    "block_index": 3,
    "section_path": [
      "NICE Guideline [NG185]: Acute Coronary Syndromes (ACS) & Chest Pain",
      "Management of NSTEMI and Unstable Angina"
    ],
    "heading": "Management of NSTEMI and Unstable Angina",
    "text": "## Management of NSTEMI and Unstable Angina\n- Assess baseline risk of future adverse cardiovascular events using a validated tool such as GRACE score.\n- Offer fondaparinux to patients without a high bleeding risk.\n- Perform coronary angiography within 72 hours for patients with intermediate or high risk (GRACE score > 3%).",
    "content_sha256": "1251281767d5011ac6e697f6f2ed168ebe969b792b4b2fcd194afb82eb250dc4",
    "provenance_type": "local_markdown",
    "source_locator": "nice_acs_chest_pain.md#Management of NSTEMI and Unstable Angina",
    "title": "NICE Guideline [NG185]: Acute Coronary Syndromes (ACS) & Chest Pain",
    "section": "Management of NSTEMI and Unstable Angina",
    "token_count": 47,
    "metadata": {
      "source_file": "nice_acs_chest_pain.md",
      "doc_id": "doc_nice_acs_chest_pain"
    }
  },
  {
    "chunk_id": "doc_nice_acute_emergencies_chunk_0",
    "document_id": "doc_nice_acute_emergencies",
    "source_id": "nice_guidelines",
    "block_index": 0,
    "section_path": [
      "NICE Guidelines: Acute Neurological & Sepsis Emergencies",
      "Overview & Context"
    ],
    "heading": "Overview & Context",
    "text": "# NICE Guidelines: Acute Neurological & Sepsis Emergencies",
    "content_sha256": "b0e7e99197ef9baa5ba323898969877f1f58ba6266677a775f70102b3e721e1e",
    "provenance_type": "local_markdown",
    "source_locator": "nice_acute_emergencies.md#Overview & Context",
    "title": "NICE Guidelines: Acute Neurological & Sepsis Emergencies",
    "section": "Overview & Context",
    "token_count": 6,
    "metadata": {
      "source_file": "nice_acute_emergencies.md",
      "doc_id": "doc_nice_acute_emergencies"
    }
  },
  {
    "chunk_id": "doc_nice_acute_emergencies_chunk_1",
    "document_id": "doc_nice_acute_emergencies",
    "source_id": "nice_guidelines",
    "block_index": 1,
    "section_path": [
      "NICE Guidelines: Acute Neurological & Sepsis Emergencies",
      "Acute Stroke & TIA [NG128]"
    ],
    "heading": "Acute Stroke & TIA [NG128]",
    "text": "## Acute Stroke & TIA [NG128]\n- Exclude hypoglycemia immediately (finger-prick glucose).\n- Use ROSIER tool to identify acute stroke.\n- **Immediate non-contrast Brain CT:** within 1 hour of arrival for patients eligible for thrombolysis/thrombectomy.\n- **Thrombolysis (Alteplase):** Administer within 4.5 hours of symptom onset if hemorrhage is excluded and no contraindications (recent surgery, active bleeding, INR > 1.7).\n- **Mechanical Thrombectomy:** within 6 hours of symptom onset for confirmed anterior circulation large vessel occlusion.\n- **Aspirin 300 mg:** Start 24 hours after thrombolysis or immediately if thrombolysis not indicated once hemorrhage excluded.",
    "content_sha256": "e03020eb056d2e4b750d751bb792225283f4f669e99aa5a86a87af9df36b71cd",
    "provenance_type": "local_markdown",
    "source_locator": "nice_acute_emergencies.md#Acute Stroke & TIA [NG128]",
    "title": "NICE Guidelines: Acute Neurological & Sepsis Emergencies",
    "section": "Acute Stroke & TIA [NG128]",
    "token_count": 89,
    "metadata": {
      "source_file": "nice_acute_emergencies.md",
      "doc_id": "doc_nice_acute_emergencies"
    }
  },
  {
    "chunk_id": "doc_nice_acute_emergencies_chunk_2",
    "document_id": "doc_nice_acute_emergencies",
    "source_id": "nice_guidelines",
    "block_index": 2,
    "section_path": [
      "NICE Guidelines: Acute Neurological & Sepsis Emergencies",
      "Sepsis in Adults [NG51 - Sepsis Six Pathway]"
    ],
    "heading": "Sepsis in Adults [NG51 - Sepsis Six Pathway]",
    "text": "## Sepsis in Adults [NG51 - Sepsis Six Pathway]\n- Give within 1 hour of recognition:\n  1. Give oxygen to maintain SpO2 94-98% (88-92% in COPD).\n  2. Take blood cultures before antibiotics.\n  3. Give empiric broad-spectrum IV antibiotics.\n  4. Give IV fluid bolus (500 ml Hartmann's or Normal Saline over <15 mins if lactate > 2 or hypotensive).\n  5. Check serial lactate and blood gas.\n  6. Measure accurate hourly urine output (catheterisation).",
    "content_sha256": "425a29ca2c66a478cc15c0a3be1fa39cde89d4ddd4a0bc72a56b01a39516e9c6",
    "provenance_type": "local_markdown",
    "source_locator": "nice_acute_emergencies.md#Sepsis in Adults [NG51 - Sepsis Six Pathway]",
    "title": "NICE Guidelines: Acute Neurological & Sepsis Emergencies",
    "section": "Sepsis in Adults [NG51 - Sepsis Six Pathway]",
    "token_count": 72,
    "metadata": {
      "source_file": "nice_acute_emergencies.md",
      "doc_id": "doc_nice_acute_emergencies"
    }
  },
  {
    "chunk_id": "doc_nice_copd_asthma_chunk_0",
    "document_id": "doc_nice_copd_asthma",
    "source_id": "nice_guidelines",
    "block_index": 0,
    "section_path": [
      "NICE Guideline [NG115 & NG80]: COPD & Acute Asthma Management",
      "Overview & Context"
    ],
    "heading": "Overview & Context",
    "text": "# NICE Guideline [NG115 & NG80]: COPD & Acute Asthma Management\nPublished: 2019 - 2024",
    "content_sha256": "19534fb831983d8d368441daa515fd9244e1d436d2827f5a815de0d6177c862b",
    "provenance_type": "local_markdown",
    "source_locator": "nice_copd_asthma.md#Overview & Context",
    "title": "NICE Guideline [NG115 & NG80]: COPD & Acute Asthma Management",
    "section": "Overview & Context",
    "token_count": 11,
    "metadata": {
      "source_file": "nice_copd_asthma.md",
      "doc_id": "doc_nice_copd_asthma"
    }
  },
  {
    "chunk_id": "doc_nice_copd_asthma_chunk_1",
    "document_id": "doc_nice_copd_asthma",
    "source_id": "nice_guidelines",
    "block_index": 1,
    "section_path": [
      "NICE Guideline [NG115 & NG80]: COPD & Acute Asthma Management",
      "Diagnosis and Assessment of COPD"
    ],